;7;"<h1>CreditUP - онлайн займ на карту на выгодных условиях.</h1>  С помощью популярного сервиса КредитАп каждый желающий имеет возможность получить займ на карту на любые житейские потребности. Компания выдает потребительские кредиты оперативно. В течении трех минут приходит ответ от представителя компании. Вы можете взять кредит онлайн в размере от ста до пяти тысяч гривен. Если клиент берет деньги в долг первый раз максимальная сумма кредита составляет 1200-1500 гривен. Процентная ставка всего 1,9%. Срок кредита от 1 до 30 дней. Денежные средства перечисляются только на банковскую карту. Сервис работает круглосуточно. Воспользоваться услугами выше представленной компании есть возможность всегда. <h2>Как оформить кредит онлайн в CreditUP?</h2> Чтобы оформить заявку нет надобности посещать офис компании. Эта процедура осуществляется на официальном интернет ресурсе. С помощью кредитного калькулятора можно рассчитать сумму возврата займа опираясь на количество необходимых денежных средств и срок кредитования. Чтобы получить кредит достаточно находиться возле компьютера, иметь доступ в сеть Интернет, при себе телефон, банковскую карту оформленную на Ваши персональные данные, паспорт и идентификационный код. <h3>Как вернуть деньги взятые в долг?</h3> Как выше было упомянуто, взять кредит на карту можно не более чем на месяц. По истечению данного срока денежные средства с процентами необходимо вернуть на счет компании. Для этого существует несколько способов: - перечисление денег с собственной банковской карты; - в личном кабинете на сайте компании, используя интернет-банкинг; - посредством платежных терминалов Citi24, EasyPay; - наличными через отделение любого банка. Каждый клиент получает кредит онлайн без лишних звонков менеджеров компании и уточнения информации. Вы имеете возможность досрочно погашать займ. Специальная бонусная система позволяет экономить денежные средства. Преимуществ хватает для того, чтобы начать пользоваться услугами выше представленного сервиса.";"CreditUP - кредит онлайн на карту банка";"<meta name='description' content='Мгновенный онлайн кредит на любые потребности, выгодные условия кредитования.'> <meta name='keywords' content='кредит онлайн,займ на карту,кредит онлайн на карту,взять кредит'>"
;8;"<h1>'Евро Гроши' - мгновенные займы онлайн.</h1>  Достаточно популярной в Европе финансовой компанией, которая уже весьма длительное время специализируется на такой услуге, как займы онлайн есть 'Евро Гроши'. Клиенты получают кредитные деньги в онлайн режиме не выходя из собственного дома на личную банковскую карту. Интерфейс сервиса простой, как и сам процесс оформления кредита. <h2>Как получить кредит онлайн от Евро Гроши?</h2> На сайте компании - Eurogroshi.com.ua каждый клиент может подсчитать сколько придется переплатить опираясь на сумму кредита и срок кредитования. Сервис предлагает кредитный лимит в размере от 500 до 2000 гривен. Но для новых клиентов максимальная сумма займа не превышает 1500 гривен. Вы имеете возможность распоряжаться кредитными средствами от 5-ти до 30-ти дней, как заблагорассудится. Процентная ставка всего - 1,9%. Чтобы получить кредит необходимо для начала заполнить заявку указав все необходимые данные. После отправки данных в течении некоторого срока в личный кабинет придет ответ. Как правило, ждать придется всего две минуты. Если все будет в порядке, следующий этап - верификация банковской карты для выплат. Необходимо, чтобы она была зарегистрированная на Вас лично. Далее подписывается онлайн договор и можно ожидать зачисления кредитных денег. Об этом также будет указано в личном кабинете. <h3>Как отдать кредит онлайн?</h3> Для возврата задолженности нужно авторизоваться на сайте, зайти в личный кабинет и воспользоваться предложенными финансовыми операциями. При досрочном погашении кредита проценты взимаются за фактический период использования кредитных средств. Выше представленная компания имеет свои представительства во всех регионах Украины. Каждая заявка обрабатывается оперативно. Нет необходимости предоставлять какие-либо дополнительные документы, справки о доходах или привлекать поручителей. Защита финансовых операций соответствует международным стандартам качества защиты персональных данных клиентов. Для постоянных клиентов сервиса действует программа лояльности. Если нужен кредит онлайн на карту, сервис Евро Гроши всегда готов пойти на встречу.";"Гроши - кредит онлайн на карту";"<meta name='description' content='Хотите получить кредит быстро и на выгодных условиях? Сервис 'Евро Гроши' к Вашим услугам.'> <meta name='keywords' content='займы онлайн,получить кредит,кредит онлайн,кредит онлайн на карту'>"
;9;"<h1>БыстроЗайм - кредит онлайн.</h1>  Компания 'БыстроЗайм' считается одним из лидеров среди МФО предоставляющих услуги по онлайн кредитованию граждан нашей страны. Принятие решения осуществляется на протяжении всего нескольких минут. Клиент получает деньги на персональную карту банка либо наличными в одном из отделений самой компании. Вам не придется оплачивать различные взносы. Скрытые комиссии полностью исключены. Вы платите деньги только за фактическое использование кредитных средств выше представленной компании. <h2>Как получить кредит онлайн в БыстроЗайм?</h2> Заходим на сайт - BistroZaim.ua. С целью создания нового аккаунта оформляем заявку на кредит онлайн заполняя все необходимые данные. Далее предстоит указать сумму кредита и срок его использования. Если Вы берете займы первый раз, максимальная сумма равняется шести тысячам гривен. В последующие разы она увеличивается до десяти тысяч. Каждый клиент имеет возможность пользоваться кредитными средствами от 7-ми до 60-ти дней. Процентная ставка - 2%. После оформления заявки и отправки данных эксперты компании в течении 20-ти минут принимают решение и сообщают о нем Вам в личном кабинете. <h3>Как вернуть займы онлайн на расчетный счет компании?</h3> Существует несколько простых способов. Самый верный - осуществить перевод средств на сайте компании в личном кабинете. Также есть возможность оплатить кредит наличными в отделении любого банка. БыстроЗайм одна из МФО, которая предлагает новым клиентам указанный выше размер кредитных денежных средств. Есть возможность досрочно погасить задолженность без начисления штрафов. Услугами компании можно пользоваться семь дней в неделю. Если по каким либо причинам кредит онлайн не получается погасить вовремя, Вам дадут 3-5 дней беспроцентной отсрочки. Для постоянных клиентов предусмотренная специальная программа лояльности. Выше представленная компания входит в состав довольно крупного холдинга, работает на финансовом рынке стабильно и уверенно. Вы всегда можете рассчитывать на помощь, когда понадобятся деньги на бытовые расходы и даже свадьбу.";"БыстроЗайм - онлайн кредит на карту банка";"<meta name='description' content='Онлайн кредит без справок, выгодные условия для каждого клиента.'> <meta name='keywords' content='займы онлайн,получить кредит,кредит онлайн,кредит онлайн на карту'>"
;10;"<h1>Moneyboom - деньги в долг на выгодных условиях.</h1>  Основным видом деятельности представленной компании есть выдача кредитных средств гражданам нашей страны в размере двух тысяч гривен сроком на тридцать дней. Минимальная сума займа составляет двести пятьдесят гривен. Процентная ставка всего 1,75%. Если Вам уже исполнилось 18 лет, есть постоянный источник дохода, банковская карта оформленная на личные данные, отсутствие предыдущих просрочек и украинское гражданство, Вы вполне можете рассчитывать на кредит онлайн от компании Moneyboom. <h2>Как получить деньги в долг?</h2> На официальном сайте стоит заполнить заявку на получение кредитных средств указав все необходимые данные в соответственных полях. После отправки заявки в течении кратчайшего времени эксперты компании рассмотрят Ваш запрос и примут решение. Чтобы исключить вероятность отказа постарайтесь детально и четко отвечать на все поставленные в анкете вопросы. В случае принятия утвердительного решения Вам об этом сообщат в личном кабинете. Денежные средства зачисляются на карту банка, после чего ими сразу же можно будет воспользоваться. Если необходим быстрый займ, лучшего сервиса не найти. Для постоянных клиентов действует программа лояльности. Сервис удобный для использования. Решения принимаются оперативно. Есть возможность досрочного погашения кредита. В случае отсутствия своевременного погашения срок кредита можно продлить. Полное отсутствие скрытых комиссий и переплат. Заявки и возврат денег принимаются круглосуточно. При повторном обращении к услугам компании максимальная сумма кредита увеличивается до семи тысяч гривен. Чтобы посчитать сумму возврата воспользуйтесь кредитным калькулятором на сайте введя необходимую сумму кредита и срок на который намеренные его получить.";"Moneyboom - кредит онлайн круглосуточно";"<meta name='description' content='Быстрый кредит онлайн на карту банка, низкая процентная ставка.'> <meta name='keywords' content='кредит онлайн,быстрый займ,деньги в долг,займы онлайн,кредит онлайн на карту'>"
;11;"<h1>Ultracash - кредит онлайн на карту банка.</h1>  Если у Вас есть доступ к сети Интернет для того чтобы взять кредит нет надобности собирать документацию о своих доходах, тратить личное время на посещение банковских учреждений, привлекать поручителей. Сервис Ultracash предоставляет услуги по быстрому кредитованию гражданам Украины в любое удобное время суток. Каждый желающий имеет возможность получить займы онлайн от 500 до 2000 гривен сроком от 1 до 30-ти дней. Процентная ставка по кредиту всего 1,2%. При последующих обращениях максимально доступная сумма увеличивается до 10 000 гривен. На официальном сайте есть кредитный калькулятор для расчета точной суммы подлежащей возврату задолженности. <h2>Как получить займы онлайн от сервиса Ultracash?</h2> Чтобы получить деньги в долг в выше представленной компании необходимо посетить ее официальный интернет ресурс, выбрать необходимую сумму кредита, указать срок в количестве дней и нажать кнопку 'Взять кредит'. Далее создаем новую учетную запись вводя логин и пароль, авторизуемся и заполняем анкету. К введенным данным необходимо прикрепить скан копии своего паспорта и идентификационного номера. Кредитные средства отправляются на персональные банковские карты клиентов. После отправки заявки на Вашей карте временно будут заблокированные средства в размере до 5-ти гривен. Эта процедура предусмотренная с целью верификации карты, чтобы защитить персональные данные клиента от мошенников. После проверки введенной информации и принятия утвердительного решения экспертами компании кредит онлайн будет зачислен на Вашу банковскую карту. <h3>Как вернуть кредит на счет компании?</h3> Есть несколько удобных способов возврата кредитных средств. Среди них: - перевод с банковской карты в личном кабинете на сайте; - банковский перевод наличными в любом банке Украины; - перевод при помощи платежных терминалов, («ПриватБанк», «Сity24», «TYME»); - пополнением счета посредством мобильного телефона. Клиенты не оплачивают комиссионных за оформление займа. При желании можно досрочно погасить кредит. Сотрудники выше представленной компании работают оперативно с каждым отдельным клиентом. Решение принимается в течении двадцати минут.";"Ultracash - быстрый займ онлайн";"<meta name='description' content='Выгодные условия кредитования и возврата кредитных средств, оперативное принятие решения, программа лояльности для постоянных клиентов.'> <meta name='keywords'content='кредит онлайн,взять кредит,быстрый займ,деньги в долг,займы онлайн,кредит онлайн на карту'>"
;12;"<h1>Mycredit - кредит онлайн на выгодных условиях.</h1>  Если Вы намеренные получить кредит оперативно и в режиме онлайн, тогда лучше с данной целью обратиться к сервису Mycredit основной специализацией которого есть быстрые микрокредиты в размере от ста до трех тысяч гривен сроком от одного до тридцати пяти дней. При этом процентная ставка всего - 0.99 - 1.3 %. Каждый желающий может получить кредит, если уже исполнилось 18 лет, есть стабильный доход, документы свидетельствующие о личности, (паспорт, идентификационный код), персональная банковская карта и доступ в сеть Интернет. Чтобы получить кредит онлайн на карту банка необходимо для начала посетить официальный интернет ресурс Mycredit и проделать несколько простых операций. <h2>Как взять кредит на сервисе Майкредит?</h2> Посетив сайт компании Вы можете взять кредит на карту в онлайн режиме. Для этого необходимо лишь желание и несколько минут свободного времени. При оформлении заявки Вам будет предложено ввести некоторые персональные данные и отправить их на проверку, которая осуществляется в автоматическом режиме с использованием специализированных программных алгоритмов. Заявка рассматривается в течении десяти минут. После утвердительного решения деньги в указанной Вами сумме поступят на карточный счет. В случае отказа повторную заявку можно подавать уже через месяц. <h3>Как отдать кредит с начисленными процентами?</h3> Каждый клиент компании имеет возможность воспользоваться одним из нескольких доступных способов возврата кредитных средств: - осуществить денежный перевод наличными в одном из отделений украинских банков; - воспользоваться платежными терминалами; - оплатить онлайн в личном кабинете на сайте с помощью пластиковой банковской карты. Займ можно также продлить, если возникла такая необходимость. Выше представленный сервис дает возможность взять кредит даже людям пенсионного возраста. Для постоянных клиентов действует программа лояльности. Участвуя в ней клиент получает некоторые преимущества в плане использования услуг сервиса Майкредит. Например, процентная ставка по кредиту занижается, увеличивается срок погашения.";"Mycredit - быстрые микрокредиты онлайн";"<meta name='description' content='Сервис микрокредитирования, низкая процентная ставка, выплаты на банковскую карту.'> <meta name='keywords' content='микрокредиты онлайн,получить кредит,кредит онлайн на карту,взять кредит'>"
