;1;"<h1>Быстрый потребительский кредит круглый год.</h1>  Если нужно быстро занять деньги в долг от 500 до 3000 гривен, стоит обратиться за помощью в компанию 'Credit 365' и Вам оперативно помогут решить эту проблему. Упомянутая компания выдает микрозаймы онлайн по всей территории нашей страны. Опытные, квалифицированные консультанты всегда готовы предоставить детальную информацию, что касается такой темы, как потребительский кредит. <h2>На каких условиях можно получить небольшой кредит наличными?</h2> На самом деле условия кредитования граждан достаточно просты. Первый кредит каждый желающий имеет возможность получить в пределах выше представленной суммы. При повторном обращении максимальная сумма кредита может достигать десяти тысяч гривен. Простая онлайн заявка на кредит оформляется на сайте компании. После ее одобрения деньги переводятся на банковскую карту клиента. Чтобы получить деньги в долг необходимы только паспорт и налоговый код. Если Вы оформляете кредит онлайн первый раз, заявка рассматривается в течении 15-ти минут. Во всех последующих случаях - на протяжении всего лишь одной минуты. Каждый клиент имеет возможность продлить срок кредита от 7-ми до 30-ти дней. Стоимость данной услуги можно посмотреть на официальном сайте в личном кабинете после авторизации. Где взять быстрый кредит уже известно. Теперь стоит разобраться в следующем вопросе. <h3>Каким способом можно вернуть потребительский кредит?</h3> Существует два основных варианта погашения кредита от компании 'Credit 365': - безналичный - при помощи интернет банкинга или в личном кабинете на сайте компании; - наличный - денежный перевод в отделении любого банка, оплата посредством платежных терминалов. Начисление процентов зависит от срока оформления кредита. Чем он больше, тем меньше процентная ставка. К тому же предусмотрена скидка на комиссию в размере 30-ти процентов при оформлении первого займа. Чтобы взять деньги в долг Вам не нужно посещать офис и подписывать договора. За повторное использование услуг выше представленной компании для каждого клиента действует бонусная программа скидок.";"Небольшой кредит наличными - 'Кредит 365'";<meta name='description' content='Компания 'Кредит 365' - лидер на рынке Украины по предоставлению услуг микрозаймов.'> <meta name='keywords' content='где взять быстрый кредит,микрозаймы онлайн,небольшой кредит,кредит наличными,кредит 365,кредит онлайн,потребительский кредит,деньги в долг,займы онлайн,кредит без справок,онлайн заявка на кредит'>"
;2;"<h1>Финансовая помощь в любой точке мира - СОС Кредит.</h1> На финансовом рынке Украины компания SOS Credit относительно не долго. Но есть несколько важных преимуществ, которые говорят о том, что все таки стоит воспользоваться ее услугами. Например, каждый желающий имеет возможность оформить кредит онлайн на самые различные потребности в любой точке мира. Для этого необходимо осуществить несколько простых действий. <h2>Как получить кредит в СОС Кредит?</h2> Данное действие можно выполнить перейдя на сайт компании. Чтобы подсчитать сколько придется переплатить за использование кредитных средств необходимо посетить официальный сайт компании и воспользоваться калькулятором. Для этого просто укажите необходимую сумму денег и срок на который Вы намеренные получить деньги в долг. Далее оформляется онлайн заявка на кредит. Вносим свои персональные данные в соответственные поля, прикрепляем скан копии документов и вводим номер личной банковской карты. На нее будут Вам в процессе перечисленные денежные средства. Когда все необходимые данные будут отправленные на согласование, остается лишь дождаться одобрения заявки, подписать договор-оферту и получить свои деньги. <h3>Способы возврата кредита онлайн.</h3> Есть несколько способов, которые предоставляет своим клиентам выше упомянутая компания для возврата долга. Среди них: - возврат займа в личном кабинете на сайте; - платежные терминалы, (Приватбанк, IBOX); - денежный перевод в любом банковском отделении; - перевод денежных средств в отделении Укрпочты. Вам не придется долго ждать, чтобы получить кредит онлайн. Процесс одобрения автоматизирован по максимуму. Скрытые комиссии и платежи отсутствуют полностью. По этому поводу не стоит беспокоится. Работать с сервисом просто. С этим вопросом сможет легко справиться даже начинающий пользователь. Использование современных технологий позволяет защитить персональные данные каждого клиента от каких-либо действий мошенников. Если нужны деньги в долг, смело обращайтесь в СОС Кредит. ";"SOS credit - кредит онлайн для различных потребностей";"<meta name='description' content='Не знаете, где взять деньги в долг? Компания SOS credit готова помочь решить Ваши финансовые проблемы.'> <meta name='keywords' content='где взять быстрый кредит,получить кредит,небольшой кредит,сос кредит,кредит онлайн,потребительский кредит,деньги в долг,займы онлайн,кредит без справок,онлайн заявка на кредит'>"
;3;"<h1>'Швидко Гроші' - получите 3000 грн. в долг за 20 мин.</h1>  На рынке финансовых услуг компания 'Швидко Гроші' одна из первых в своем роде начала предоставлять гражданам услугу оформления кредита в размере до трех тысяч гривен всего за двадцать минут. Основная специализация выше представленной компании - быстрый кредит онлайн. За время деятельности был накоплен достаточный опыт для того, чтобы предоставляемые услуги осуществлялись качественно и оперативно. <h2>Как оформить быстрый кредит наличными?</h2> Каждый желающий имеет возможность оформить кредит без справок на сайте - SGroshi.com.ua. Для этого Вам необходимо открыть данный интернет ресурс имея возле себя два обычных документа - личный паспорт и идентификационный налоговый код. Подобной документацией обладает каждый гражданин Украины. Далее оформляется онлайн заявка на кредит. Для этого придется потратить десять минут. Когда данный этап будет пройден и указанные Вами данные отправлены на обработку, в течении двадцати минут кредитный инспектор сообщит о результате Вашего запроса. В случае утвердительного решения Вы имеете возможность оперативно получить запрашиваемую сумму кредита в ближайшем отделении компании. В случае последующих обращений процесс сократится до пяти минут. <h3>Как вернуть займы онлайн?</h3> По истечении кредитного периода клиент может вернуть полученные деньги в долг несколькими доступными способами: - обратившись в отделение компании 'Швидко Гроші'; - с помощью банковских карт Visa и MasterCard на сайте SGroshi.com.ua; - через любое отделение банка; - посредством платежного терминала. <h4>Основные преимущества получения кредита от компании 'Швидко Гроші'.</h4> В случае досрочного погашения кредита оплата взимается только за фактический срок использования кредитных денег. Можно продлевать срок кредита на любой удобный период. Отделения компании находятся по всей стране. Чтобы получить быстрый займ нет надобности привлекать поручителей и доставать справки о доходах. Все делается легко и быстро.";"Быстрый кредит наличными от 'Швидко Гроші'";"<meta name='description' content='Нужны деньги в долг, быстро и без справок? Вы можете оперативно получить кредит онлайн в компании 'Швидко Гроші'> <meta name='keywords' content='где взять быстрый кредит,кредит наличными,швидко гроші,кредит онлайн,потребительский кредит,деньги в долг,займы онлайн,кредит без справок,онлайн заявка на кредит'>"
;4;"<h1>CCloan - быстрый кредит онлайн.</h1> CCloan является международной финансовой организацией, которая поможет оформить кредит онлайн в любой точке Украины. Каждый клиент имеет возможность взять деньги в долг почти мгновенно. Финансовые средства перечисляются на банковскую карту или финансовый счет заемщика. Для получения кредита Вам понадобятся лишь компьютер с доступом к всемирной сети, паспорт, налоговый код и мобильный телефон. Когда все перечисленное будет под руками, можно смело переходить к оформлению заявки. <h2>Как получить потребительский кредит в компании CCloan?</h2> В первую очередь необходимо пройти быструю регистрацию на сайте ccloan.ua. Данная процедура проста. Далее оформляется заявка на онлайн кредит. Затем следует выбрать сумму кредита и указать сроки кредитования. В первый раз Вам предоставят возможность воспользоваться займом в размере от 400 до 2000 гривен. При повторном обращении сумма изменится до 10 000 гривен. Отправленная клиентом заявка рассматривается в течении всего лишь десяти минут. Чтобы получить займы онлайн нет надобности посещать офис компании. После утвердительного решения деньги будут зачисленными на Ваш банковский или карточный счет. <h3>Как вернуть кредит онлайн?</h3> Для своих клиентов выше представленная компания приготовила несколько доступных и удобных способа возврата кредитных средств. Среди них: - погашение при помощи банковской карты через личный кабинет на сайте; - оплата посредством терминалов EasyPay или iBox; - банковский перевод на персональный счет компании. Выбирайте любой из удобных именно Вам. При первом займе комиссия не взимается. Для постоянных клиентов действует бонусная программа, проводятся розыгрыши призов, различные акции. Вы можете пользоваться займом неограниченное время при условии внесения оплаты за использование системы каждые 5, 10, 15, 20, 25, 30 дней. Компания лояльно относится к своим клиентам. Именно по этому начисляет не высокие процентные ставки. Сотрудничать с CCloan выгодно и Вы имеете все шансы убедиться в этом лично.";"CCloan - выгодный кредит онлайн";"<meta name='description' content='Теперь получить потребительский кредит легко, заявку можно оформить на сайте компании.'> <meta name='keywords' content='где взять быстрый кредит,получить кредит,небольшой кредит,ссloan,кредит онлайн,потребительский кредит,деньги в долг,займы онлайн,кредит без справок,онлайн заявка на кредит'>"
;5;"<h1>KLT CREDIT - деньги в долг.</h1>  Сервис KLT CREDIT является некой альтернативой современной системе банковского кредитования граждан Украины. Хотя на нашем финансовом рынке представленная компания предоставляет свои услуги недавно, но ее деятельность характеризуется с положительной стороны. Каждый желающий может получить деньги в долг быстро и на весьма выгодных условиях. Чтобы взять кредит онлайн ненужно идти в банк, предоставлять справку о доходах, подписывать множество бумаг и искать поручителя. Сервис работает круглосуточно и без выходных. <h2>Как получить кредит в компании KLT CREDIT?</h2> Для начала стоит посетить сайт - kltcredit.com.ua и с помощью специального калькулятора рассчитать суму возврата займа, предварительно указав сколько денег требуется и на какой именно срок. Далее заполняется простая онлайн заявка на кредит. В максимально краткий срок, (5-10 минут), представитель компании сообщит Вам о принятом решении. Если все в порядке деньги поступят на банковскую карту. Как правило это происходит в течении 15-ти минут после принятия утвердительного решения. Вы можете пользоваться кредитными средствами в течении 65-ти дней. В скором времени максимальная сумма займа будет увеличена до 15 000 гривен. Теперь разберем следующий вопрос, где взять быстрый кредит Вам уже известно. <h3>Как вернуть потребительский кредит на счет компании?</h3> Вы имеете возможность воспользоваться консервативным способом. То есть, осуществить денежный перевод в отделении любого банка. Если не желаете стоять в очередях возле кассы, тогда можете воспользоваться платежным терминалом Приватбанка или же, что еще проще - рассчитаться посредством интернет-банкинга своей пластиковой картой, (VISA, MasterCard). Чтобы взять деньги в долг в выше представленной компании необходимы только данные паспорта и личного идентификационного номера клиента. Выгода еще в том, что процентная ставка за использование кредитных средств не высока. Также отсутствуют скрытые комиссии и оплата страхового полиса. По срокам использования займа и его сумме данная компания считается одной из лучших в Украине.";"KLT CREDIT - займы онлайн";"<meta name='description' content='Микрофинансовая компания KLT CREDIT - онлайн кредит на выгодных условиях.'> <meta name='keywords' content='где взять быстрый кредит,получить кредит,небольшой кредит,кредит онлайн,потребительский кредит,деньги в долг,займы онлайн,кредит без справок,онлайн заявка на кредит'>"
;6;"<h1>CreditOn - деньги в долг на карту банка.</h1>  Сервис предоставляет гражданам Украины возможность практически мгновенно оформить онлайн кредит не выходя из собственного дома. Для этого Вам понадобится компьютер с доступом в всемирную сеть, минимум документов, (паспорт и идентификационный код), карта банка оформленная на Вас лично и немножко свободного времени. Скрытые платежи и комиссии полностью отсутствуют. Вы можете оформить быстрый займ на сумму от 200 до 3000 гривен. Если посчитаете нужным дальше пользоваться услугами представленного сервиса максимальная сумма кредита увеличится уже до 15 000 гривен. Взять кредит онлайн на карту любого банка Украины сроком от одного до двадцати одного дня достаточно просто. Процентная ставка всего - 1,9%. <h2>Как получить займы онлайн на сервисе?</h2> После заполнения заявки на сайте компании и указания всех необходимых данных в течении 15-ти минут Вам придет ответ. Если он будет утвердительным, денежные средства в указанном размере перечисляются на банковскую карту. В 80-90% случаев компания не отказывает в помощи своим клиентам. Для оформления нужен только паспорт и идентификационный код. <h3>Как вернуть быстрый займ с процентами на счет компании?</h3> Сервис предоставляет несколько удобных способов возврата кредитных средств. Среди них: - банковский перевод в отделении любого банка Украины; - перевод с помощью платежного терминала; - погашение задолженности посредством банковской карты в личном кабинете на сайте. Выше перечисленные способы удобные и доступные каждому. Если по каким-то причинам отсутствует возможность своевременного погашения кредита можно заказать услугу пролонгации в результате чего клиент получает дополнительных десять дней на оплату задолженности. Если есть желание погасить долг досрочно, такая возможность также предоставленная каждому отдельному клиенту сервиса. Вы платите только за фактические дни использования займа и ни копейки больше. Компания относительно молодая, но уже успела зарекомендовать себя на финансовом рынке нашей страны с положительной стороны, благодаря качеству и оперативности предоставляемых услуг.";"CreditOn - быстрый кредит онлайн";"<meta name='description' content='Получить быстрый займ можно на сервисе CreditOn, заявки принимаются в любое время суток.'> <meta name='keywords' content='кредит онлайн,быстрый займ,деньги в долг,займы онлайн,кредит онлайн на карту'>"
